<?xml version="1.0" encoding="UTF-8"?>
<system xmlns:xsi="http://www.w3.org/2001/XMLSchema-instance"
 xsi:noNamespaceSchemaLocation="../../xml/espml.xsd">
 <id>http://128.97.93.154:7081</id>
 <field>
  <id>1</id>
  <location>
   <polygon>
    <poslist>34.0888,-118.4305,0.00</poslist>
   </polygon>
  </location>
  <function name="uploadLocation">
  </function>
  <function name="uploadMedia">
  </function>
 </field>
</system>
